id,vertical,logical_category,subcategory,Param1,Param2,Param3,title,description,LocationName,city,region,price,image_url,url_item,ext_user_id,weborama_id,interests
2225740831,General,General.GoodsForBusiness,Оборудование для бизнеса,Другое,,,Asic Antminer l3,"Asic Antminer l3. Быстрая доставка из Китая до Москвы!🚀  💸Актуальные цены по запросу!  👍Все оборудование в комплекте с блоком питания  🚚Собственный офис в Шэньчжэнь, прямые поставки из Китая!  - - - -  ➡ Напишите нам &amp;#34;хочу прайс&amp;#34;.  ➡ Быстро отправим и добавим в наш чат WhatsApp / Telegram  ➡ По запросу отправим наш сайт и Телеграм канал  - - - -  • Предзаказ от лучшего поставщика из Китая  • Работаем по договору с физ и юр лицами  • Приветствуем личную встречу с клиентами  • Отправка в регионы  • Полная видео проверка перед отправкой из Китая!  - - - -  ⭐⭐⭐⭐⭐ Наш рейтинг на Авито 5.0  - - - -  📲Звоните/пишите прямо сейчас!  Добавляйте объявление в ❤Избранное, чтобы не потерять.  - - - -  💸Актуальные цены:  🔥От 5 шт - 75100  🔥От 10 шт - 73100  🔥От 20 шт - 68700  *Количество ограничено, цены меняются каждый день.  - - - -  💥ПОМОЖЕМ ПОДОБРАТЬ ЛЮБОЕ ИНТЕРЕСУЮЩИЕ ВАС ОБОРУДОВАНИЕ ПО САМЫМ ВЫГОДНЫМ ЦЕНАМ!  💥ДОПОЛНИТЕЛЬНО ПРЕДЛАГАЕМ ПАРТНЕРСКУЮ ПРОШИВКУ ДЛЯ ВАШЕГО ОБОРУДОВАНИЯ!  - - - -  👉 ВНИМАНИЕ! Мы предоставляем услуги по размещению в собственном отеле 4.50 кВт/час (обслуживание, охрана, доступ 24/7 удалённо, бесперебойная работа под наблюдением специалистов и uptime 24/7).  👉 Сейчас свободно 700 кВат.  - - - -  Наши преимущества:  ↪ Работаем с 2019 года, все это время помогаем клиентам подобрать оборудование для добычи криптовалюты по самым низким ценам. Берем небольшую комиссию т.к работаем на объём. Предлагаем клиентам оформлять сборные заказы для максимальной выгоды. Работаем по всей России!  - - - -  📌Нажмите на профиль справа или внизу объявления. У нас широкий выбор оборудования для майнинга!  📌Будем рады помочь, ваш CryptoExpert.  Энергопотребление: 821 W  Скорость: 568 Mh/s  Серийный номер: SNWEX",Воронеж,Воронеж,Воронежская область,68700.000000000000000,https://38.img.avito.st/640x480/11727320138.jpg,https://avito.ru/2225740831?utm_medium=cpc&avito_campaign_id=1232320950223423484&utm_source=buzzoola&utm_campaign=web_buzzoola_buyers_b2b_common_all_network_15082021_any_none_b2b,154893523,121823,"Lifestyles & Hobbies/Business Professionals,Beauty & Wellness/Frequently Visits Salons,Vehicles & Transportation/Auto Enthusiasts,Home & Garden/Do-It-Yourselfers"
2183363341,General,General.GoodsForBusiness,Оборудование для бизнеса,Промышленное,,,"Сегментный листогиб, листогибочный станок (новый)","НОВЫЙ сегментный листогибочный станок PBB 1020 под металл до 2,5 мм для изготовления различных изделий из листовых материалов (гибка изделий на четыре стороны) от официального дилера ООО КВСИСТЕМС. ЗВОНИТЕ!!!📞  💯 РАБОТАЕМ ПО ВСЕЙ РОССИИ! ОФИЦИАЛЬНАЯ ГАРАНТИЯ! ОБОРУДОВАНИЕ ОТ ЛУЧШИХ МИРОВЫХ ПРОИЗВОДИТЕЛЕЙ!  ✅ Характеристики:  - рабочая длина (мм): 1020  - максимальная толщина металла (мм): 2,5  - максимальный угол гиба: 135 град.  - количество сегментных балок - 1 (прижимная)  - глубина подачи листа – неограниченная  - имеет 11 сегментов разных размеров: 25 мм, 30 мм, 35 мм, 40 мм, 45 мм, 50 мм, 75 мм, 100 мм, 150 мм, 200 мм, 270 мм  - преимущества: быстрая работа за счёт ножной педали, возможность гнуть толстый лист благодаря мощному амортизатору на гибочной балке  - вес (кг): 280  ☎️ Позвольте нашим менеджерам подобрать оборудование именно под Ваш бизнес! ЗВОНИТЕ и они сориентируют Вас по оборудованию для производства вентиляционного оборудования, труб, дымоходов, водосточных систем, кровли﻿, фасадных кассет, линеарных панелей, металлических дверей, котлов, дорожных знаков и многих других изделий из листового металла. Ребята ПОДСКАЖУТ по аналогам выгодным именно Вам!  ✅ Также для Вас:  ▪️ помощь и профессиональная консультация в выборе станков, инструмента, оснастки  ▪️ подбор необходимого оборудования для комплектации цеха по производству готовых изделий  ▪️ содействие в запуске производства, настройка и пуско-наладка станков  ▪️ консультации по расширению и оптимизации вашего производства  ▪️ снабжение запасными частями и сервис в течение всего срока службы станка  Преимущества работы с нами:  🏆 Официальный дилер, более 10 лет опыта  🏭 Работаем с лучшими производителями мира  🛠️ Гарантийное и постгарантийное сервисное обслуживание  🤝 Различные формы оплаты  💳 Возможен КРЕДИТ или РАССРОЧКА  🏦 ЛИЗИНГ для компаний  🚚 доставка ПО ВСЕЙ РОССИИ!  👍 ГАРАНТИЯ на продукцию от 12 месяцев  🕑 Работаем с 09:00 до 20:00  Также есть возможность посещения нашего офиса в Москве! Позвоните, и мы подготовим для Вас предложение к приезду.  ☎️ЗВОНИТЕ и ПИШИТЕ (можно на WatsApp и Viber)! С радостью ответим на все ваши вопросы!☎️",Воронеж,Воронеж,Воронежская область,128286.000000000000000,https://08.img.avito.st/640x480/11670598208.jpg,https://avito.ru/2183363341?utm_medium=cpc&avito_campaign_id=1232320950223423484&utm_source=buzzoola&utm_campaign=web_buzzoola_buyers_b2b_common_all_network_15082021_any_none_b2b,92830185,121823,"Lifestyles & Hobbies/Business Professionals,Beauty & Wellness/Frequently Visits Salons,Vehicles & Transportation/Auto Enthusiasts,Home & Garden/Do-It-Yourselfers"
2215826526,General,General.GoodsForBusiness,Оборудование для бизнеса,Промышленное,,,"Сквозной листогиб, листогибочный станок (новый)","НОВЫЙ сквозной листогибочный станок 2000С с роликовым ножом в комплекте на 2 метра для производства изделий из тонко-листовой стали, алюминия и меди от официального дилера ООО КВСИСТЕМС. ЗВОНИТЕ!!!📞  💯 РАБОТАЕМ ПО ВСЕЙ РОССИИ! ОФИЦИАЛЬНАЯ ГАРАНТИЯ! ОБОРУДОВАНИЕ ОТ ЛУЧШИХ МИРОВЫХ ПРОИЗВОДИТЕЛЕЙ!  ✅ Характеристики:  - рабочая длина (мм): 2150  - максимальная толщина металла (мм): 0,7  - максимальный угол гиба: 140 град.  - глубина подачи листа: неограниченная  - работает с окрашенным металлом (не царапает)  - в комплекте со станком: роликовый нож и фальцедогибающая машинка.  - вес (кг): 130 (удобно транспортировать с объекта на объект)  ✅ У нас также Вы можете приобрести сквозной листогибочный станок 2500С с рабочей длиной 2650 мм. Подробности уточните у нашего специалиста!  ☎️ Позвольте нашим менеджерам подобрать оборудование именно под Ваш бизнес! ЗВОНИТЕ и они сориентируют Вас по оборудованию для производства вентиляционного оборудования, труб, дымоходов, водосточных систем, кровли﻿, фасадных кассет, линеарных панелей, металлических дверей, котлов, дорожных знаков и многих других изделий из листового металла. Ребята ПОДСКАЖУТ по аналогам выгодным именно Вам!  ✅ Также для Вас:  ▪️ помощь и профессиональная консультация в выборе станков, инструмента, оснастки  ▪️ подбор необходимого оборудования для комплектации цеха по производству готовых изделий  ▪️ содействие в запуске производства, настройка и пуско-наладка станков  ▪️ консультации по расширению и оптимизации вашего производства  ▪️ снабжение запасными частями и сервис в течение всего срока службы станка  Преимущества работы с нами:  🏆 Официальный дилер, более 10 лет опыта  🏭 Работаем с лучшими производителями мира  🛠️ Гарантийное и постгарантийное сервисное обслуживание  🤝 Различные формы оплаты  💳 Возможен КРЕДИТ или РАССРОЧКА  🏦 ЛИЗИНГ для компаний  🚚 доставка ПО ВСЕЙ РОССИИ!  👍 ГАРАНТИЯ на продукцию от 12 месяцев  🕑 Работаем с 09:00 до 20:00  Также есть возможность посещения нашего офиса в Москве или демо-зала! Позвоните, и мы подготовим для Вас предложение к приезду.  ☎️ЗВОНИТЕ и ПИШИТЕ (можно на WatsApp и Viber)! С радостью ответим на все ваши вопросы!☎️",Воронеж,Воронеж,Воронежская область,69900.000000000000000,https://12.img.avito.st/640x480/11718587112.jpg,https://avito.ru/2215826526?utm_medium=cpc&avito_campaign_id=1232320950223423484&utm_source=buzzoola&utm_campaign=web_buzzoola_buyers_b2b_common_all_network_15082021_any_none_b2b,92830185,121823,"Lifestyles & Hobbies/Business Professionals,Beauty & Wellness/Frequently Visits Salons,Vehicles & Transportation/Auto Enthusiasts,Home & Garden/Do-It-Yourselfers"
2225645926,General,General.GoodsForBusiness,Оборудование для бизнеса,Другое,,,Asic Antminer l3,"Asic Antminer l3. Быстрая доставка из Китая до Москвы!🚀  💸Актуальные цены по запросу!  👍Все оборудование в комплекте с блоком питания  🚚Собственный офис в Шэньчжэнь, прямые поставки из Китая!  - - - -  ➡ Напишите нам &amp;#34;хочу прайс&amp;#34;.  ➡ Быстро отправим и добавим в наш чат WhatsApp / Telegram  ➡ По запросу отправим наш сайт и Телеграм канал  - - - -  • Предзаказ от лучшего поставщика из Китая  • Работаем по договору с физ и юр лицами  • Приветствуем личную встречу с клиентами  • Отправка в регионы  • Полная видео проверка перед отправкой из Китая!  - - - -  ⭐⭐⭐⭐⭐ Наш рейтинг на Авито 5.0  - - - -  📲Звоните/пишите прямо сейчас!  Добавляйте объявление в ❤Избранное, чтобы не потерять.  - - - -  💸Актуальные цены:  🔥От 5 шт - 75100  🔥От 10 шт - 73100  🔥От 20 шт - 68700  *Количество ограничено, цены меняются каждый день.  - - - -  💥ПОМОЖЕМ ПОДОБРАТЬ ЛЮБОЕ ИНТЕРЕСУЮЩИЕ ВАС ОБОРУДОВАНИЕ ПО САМЫМ ВЫГОДНЫМ ЦЕНАМ!  💥ДОПОЛНИТЕЛЬНО ПРЕДЛАГАЕМ ПАРТНЕРСКУЮ ПРОШИВКУ ДЛЯ ВАШЕГО ОБОРУДОВАНИЯ!  - - - -  👉 ВНИМАНИЕ! Мы предоставляем услуги по размещению в собственном отеле 4.50 кВт/час (обслуживание, охрана, доступ 24/7 удалённо, бесперебойная работа под наблюдением специалистов и uptime 24/7).  👉 Сейчас свободно 700 кВат.  - - - -  Наши преимущества:  ↪ Работаем с 2019 года, все это время помогаем клиентам подобрать оборудование для добычи криптовалюты по самым низким ценам. Берем небольшую комиссию т.к работаем на объём. Предлагаем клиентам оформлять сборные заказы для максимальной выгоды. Работаем по всей России!  - - - -  📌Нажмите на профиль справа или внизу объявления. У нас широкий выбор оборудования для майнинга!  📌Будем рады помочь, ваш CryptoExpert.  Энергопотребление: 778 W  Скорость: 532 Mh/s  Серийный номер: PQWPM",Воронеж,Воронеж,Воронежская область,68700.000000000000000,https://40.img.avito.st/640x480/11727320340.jpg,https://avito.ru/2225645926?utm_medium=cpc&avito_campaign_id=1232320950223423484&utm_source=buzzoola&utm_campaign=web_buzzoola_buyers_b2b_common_all_network_15082021_any_none_b2b,154893523,121823,"Lifestyles & Hobbies/Business Professionals,Beauty & Wellness/Frequently Visits Salons,Vehicles & Transportation/Auto Enthusiasts,Home & Garden/Do-It-Yourselfers"
2224906585,General,General.GoodsForBusiness,Оборудование для бизнеса,Другое,,,Asic Antminer l3,"Asic Antminer l3. Быстрая доставка из Китая до Москвы!🚀  💸Актуальные цены по запросу!  👍Все оборудование в комплекте с блоком питания  🚚Собственный офис в Шэньчжэнь, прямые поставки из Китая!  - - - -  ➡ Напишите нам &amp;#34;хочу прайс&amp;#34;.  ➡ Быстро отправим и добавим в наш чат WhatsApp / Telegram  ➡ По запросу отправим наш сайт и Телеграм канал  - - - -  • Предзаказ от лучшего поставщика из Китая  • Работаем по договору с физ и юр лицами  • Приветствуем личную встречу с клиентами  • Отправка в регионы  • Полная видео проверка перед отправкой из Китая!  - - - -  ⭐⭐⭐⭐⭐ Наш рейтинг на Авито 5.0  - - - -  📲Звоните/пишите прямо сейчас!  Добавляйте объявление в ❤Избранное, чтобы не потерять.  - - - -  💸Актуальные цены:  🔥От 5 шт - 75100  🔥От 10 шт - 73100  🔥От 20 шт - 68700  *Количество ограничено, цены меняются каждый день.  - - - -  💥ПОМОЖЕМ ПОДОБРАТЬ ЛЮБОЕ ИНТЕРЕСУЮЩИЕ ВАС ОБОРУДОВАНИЕ ПО САМЫМ ВЫГОДНЫМ ЦЕНАМ!  💥ДОПОЛНИТЕЛЬНО ПРЕДЛАГАЕМ ПАРТНЕРСКУЮ ПРОШИВКУ ДЛЯ ВАШЕГО ОБОРУДОВАНИЯ!  - - - -  👉 ВНИМАНИЕ! Мы предоставляем услуги по размещению в собственном отеле 4.50 кВт/час (обслуживание, охрана, доступ 24/7 удалённо, бесперебойная работа под наблюдением специалистов и uptime 24/7).  👉 Сейчас свободно 700 кВат.  - - - -  Наши преимущества:  ↪ Работаем с 2019 года, все это время помогаем клиентам подобрать оборудование для добычи криптовалюты по самым низким ценам. Берем небольшую комиссию т.к работаем на объём. Предлагаем клиентам оформлять сборные заказы для максимальной выгоды. Работаем по всей России!  - - - -  📌Нажмите на профиль справа или внизу объявления. У нас широкий выбор оборудования для майнинга!  📌Будем рады помочь, ваш CryptoExpert.  Энергопотребление: 772 W  Скорость: 526 Mh/s  Серийный номер: 9EDC4",Воронеж,Воронеж,Воронежская область,68700.000000000000000,https://35.img.avito.st/640x480/11727319735.jpg,https://avito.ru/2224906585?utm_medium=cpc&avito_campaign_id=1232320950223423484&utm_source=buzzoola&utm_campaign=web_buzzoola_buyers_b2b_common_all_network_15082021_any_none_b2b,154893523,121823,"Lifestyles & Hobbies/Business Professionals,Beauty & Wellness/Frequently Visits Salons,Vehicles & Transportation/Auto Enthusiasts,Home & Garden/Do-It-Yourselfers"
2225799745,General,General.GoodsForBusiness,Оборудование для бизнеса,Другое,,,Asic Antminer Т17 42тн,"Asic Antminer Т17 42ТН. Быстрая доставка из Китая до Москвы!🚀  💸Актуальные цены по запросу!  👍Все оборудование в комплекте с блоком питания  🚚Собственный офис в Шэньчжэнь, прямые поставки из Китая!  - - - -   ➡ Напишите нам &amp;#34;хочу прайс&amp;#34;.  ➡ Быстро отправим и добавим в наш чат WhatsApp / Telegram  ➡ По запросу отправим наш сайт и Телеграм канал  - - - -  • Предзаказ от лучшего поставщика из Китая  • Работаем по договору с физ и юр лицами  • Приветствуем личную встречу с клиентами  • Отправка в регионы  • Полная видео проверка перед отправкой из Китая!  - - - -  ⭐⭐⭐⭐⭐ Наш рейтинг на Авито 5.0  - - - -  📲Звоните/пишите прямо сейчас!  Добавляйте объявление в ❤Избранное, чтобы не потерять.  - - - -  💥ПОМОЖЕМ ПОДОБРАТЬ ЛЮБОЕ ИНТЕРЕСУЮЩИЕ ВАС ОБОРУДОВАНИЕ ПО САМЫМ ВЫГОДНЫМ ЦЕНАМ!  💥ДОПОЛНИТЕЛЬНО ПРЕДЛАГАЕМ ПАРТНЕРСКУЮ ПРОШИВКУ ДЛЯ ВАШЕГО ОБОРУДОВАНИЯ!  - - - -  👉 ВНИМАНИЕ! Мы предоставляем услуги по размещению в собственном отеле 4.50 кВт/час (обслуживание, охрана, доступ 24/7 удалённо, бесперебойная работа под наблюдением специалистов и uptime 24/7).  👉 Сейчас свободно 700 кВат.  - - - -  Наши преимущества:  ↪ Работаем с 2019 года, все это время помогаем клиентам подобрать оборудование для добычи криптовалюты по самым низким ценам. Берем небольшую комиссию т.к работаем на объём. Предлагаем клиентам оформлять сборные заказы для максимальной выгоды. Работаем по всей России!  - - - -  📌Нажмите на профиль справа или внизу объявления. У нас широкий выбор оборудования для майнинга!  📌Будем рады помочь, ваш CryptoExpert.  ↙↙ Ниже топ 6 ↘↘",Воронеж,Воронеж,Воронежская область,135000.000000000000000,https://74.img.avito.st/640x480/11595764274.jpg,https://avito.ru/2225799745?utm_medium=cpc&avito_campaign_id=1232320950223423484&utm_source=buzzoola&utm_campaign=web_buzzoola_buyers_b2b_common_all_network_15082021_any_none_b2b,154893523,121823,"Lifestyles & Hobbies/Business Professionals,Beauty & Wellness/Frequently Visits Salons,Vehicles & Transportation/Auto Enthusiasts,Home & Garden/Do-It-Yourselfers"
