id,vertical,logical_category,subcategory,Param1,Param2,Param3,title,description,LocationName,city,region,price,image_url,url_item,ext_user_id,weborama_id,interests
2225603865,General,General.GoodsForBusiness,Оборудование для бизнеса,Другое,,,"Asic Antminer S9 13,5 TH с бп","Asic Antminer S9 13,5 TH с бп. Быстрая доставка из Китая до Москвы!🚀  💸Актуальные цены по запросу!  👍Все оборудование в комплекте с блоком питания  🚚Собственный офис в Шэньчжэнь, прямые поставки из Китая!  - - - -  ➡ Напишите нам &amp;#34;хочу прайс&amp;#34;.  ➡ Быстро отправим и добавим в наш чат WhatsApp / Telegram  ➡ По запросу отправим наш сайт и Телеграм канал  - - - -  • Предзаказ от лучшего поставщика из Китая  • Работаем по договору с физ и юр лицами  • Приветствуем личную встречу с клиентами  • Отправка в регионы  • Полная видео проверка перед отправкой из Китая!  - - - -  ⭐⭐⭐⭐⭐ Наш рейтинг на Авито 5.0  - - - -  📲Звоните/пишите прямо сейчас!  Добавляйте объявление в ❤Избранное, чтобы не потерять.  - - - -  💥ПОМОЖЕМ ПОДОБРАТЬ ЛЮБОЕ ИНТЕРЕСУЮЩИЕ ВАС ОБОРУДОВАНИЕ ПО САМЫМ ВЫГОДНЫМ ЦЕНАМ!  💥ДОПОЛНИТЕЛЬНО ПРЕДЛАГАЕМ ПАРТНЕРСКУЮ ПРОШИВКУ ДЛЯ ВАШЕГО ОБОРУДОВАНИЯ!  - - - -  👉 ВНИМАНИЕ! Мы предоставляем услуги по размещению в собственном отеле 4.50 кВт/час (обслуживание, охрана, доступ 24/7 удалённо, бесперебойная работа под наблюдением специалистов и uptime 24/7).  👉 Сейчас свободно 700 кВат.  - - - -  Наши преимущества:  ↪ Работаем с 2019 года, все это время помогаем клиентам подобрать оборудование для добычи криптовалюты по самым низким ценам. Берем небольшую комиссию т.к работаем на объём. Предлагаем клиентам оформлять сборные заказы для максимальной выгоды. Работаем по всей России!  - - - -  📌Нажмите на профиль справа или внизу объявления. У нас широкий выбор оборудования для майнинга!  📌Будем рады помочь, ваш CryptoExpert.  Серийный номер: NMRRs1w0",Воронеж,Воронеж,Воронежская область,25960.000000000000000,https://93.img.avito.st/640x480/11727319693.jpg,https://avito.ru/2225603865?utm_medium=cpc&avito_campaign_id=1232320950223423484&utm_source=buzzoola&utm_campaign=web_buzzoola_buyers_b2b_common_all_network_15082021_any_none_b2b,154893523,121823,"Lifestyles & Hobbies/Business Professionals,Beauty & Wellness/Frequently Visits Salons,Vehicles & Transportation/Auto Enthusiasts,Home & Garden/Do-It-Yourselfers"
2225654718,General,General.GoodsForBusiness,Оборудование для бизнеса,Другое,,,Asic Avalon A1166 Pro 75TH 46W,"Asic Avalon A1166 Pro 75TH 46W. Быстрая доставка из Китая до Москвы!🚀  💸Актуальные цены по запросу!  👍Все оборудование в комплекте с блоком питания  🚚Собственный офис в Шэньчжэнь, прямые поставки из Китая!  - - - -   ➡ Напишите нам &amp;#34;хочу прайс&amp;#34;.  ➡ Быстро отправим и добавим в наш чат WhatsApp / Telegram  ➡ По запросу отправим наш сайт и Телеграм канал  - - - -  • Предзаказ от лучшего поставщика из Китая  • Работаем по договору с физ и юр лицами  • Приветствуем личную встречу с клиентами  • Отправка в регионы  • Полная видео проверка перед отправкой из Китая!  - - - -  ⭐⭐⭐⭐⭐ Наш рейтинг на Авито 5.0  - - - -  📲Звоните/пишите прямо сейчас!  Добавляйте объявление в ❤Избранное, чтобы не потерять.  - - - -  💥ПОМОЖЕМ ПОДОБРАТЬ ЛЮБОЕ ИНТЕРЕСУЮЩИЕ ВАС ОБОРУДОВАНИЕ ПО САМЫМ ВЫГОДНЫМ ЦЕНАМ!  💥ДОПОЛНИТЕЛЬНО ПРЕДЛАГАЕМ ПАРТНЕРСКУЮ ПРОШИВКУ ДЛЯ ВАШЕГО ОБОРУДОВАНИЯ!  - - - -  👉 ВНИМАНИЕ! Мы предоставляем услуги по размещению в собственном отеле 4.50 кВт/час (обслуживание, охрана, доступ 24/7 удалённо, бесперебойная работа под наблюдением специалистов и uptime 24/7).  👉 Сейчас свободно 700 кВат.  - - - -  Наши преимущества:  ↪ Работаем с 2019 года, все это время помогаем клиентам подобрать оборудование для добычи криптовалюты по самым низким ценам. Берем небольшую комиссию т.к работаем на объём. Предлагаем клиентам оформлять сборные заказы для максимальной выгоды. Работаем по всей России!  - - - -  📌Нажмите на профиль справа или внизу объявления. У нас широкий выбор оборудования для майнинга!  📌Будем рады помочь, ваш CryptoExpert.  ↙↙ Ниже топ 6 ↘↘",Воронеж,Воронеж,Воронежская область,442694.000000000000000,https://42.img.avito.st/640x480/11595751342.jpg,https://avito.ru/2225654718?utm_medium=cpc&avito_campaign_id=1232320950223423484&utm_source=buzzoola&utm_campaign=web_buzzoola_buyers_b2b_common_all_network_15082021_any_none_b2b,154893523,121823,"Lifestyles & Hobbies/Business Professionals,Beauty & Wellness/Frequently Visits Salons,Vehicles & Transportation/Auto Enthusiasts,Home & Garden/Do-It-Yourselfers"
2225744775,General,General.GoodsForBusiness,Оборудование для бизнеса,Другое,,,Asic Innosilicon T2TZ 30 TH,"Asic Innosilicon T2TZ 30 TH. Быстрая доставка из Китая до Москвы!🚀  💸Актуальные цены по запросу!  👍Все оборудование в комплекте с блоком питания  🚚Собственный офис в Шэньчжэнь, прямые поставки из Китая!  - - - -   ➡ Напишите нам &amp;#34;хочу прайс&amp;#34;.  ➡ Быстро отправим и добавим в наш чат WhatsApp / Telegram  ➡ По запросу отправим наш сайт и Телеграм канал  - - - -  • Предзаказ от лучшего поставщика из Китая  • Работаем по договору с физ и юр лицами  • Приветствуем личную встречу с клиентами  • Отправка в регионы  • Полная видео проверка перед отправкой из Китая!  - - - -  ⭐⭐⭐⭐⭐ Наш рейтинг на Авито 5.0  - - - -  📲Звоните/пишите прямо сейчас!  Добавляйте объявление в ❤Избранное, чтобы не потерять.  - - - -  💥ПОМОЖЕМ ПОДОБРАТЬ ЛЮБОЕ ИНТЕРЕСУЮЩИЕ ВАС ОБОРУДОВАНИЕ ПО САМЫМ ВЫГОДНЫМ ЦЕНАМ!  💥ДОПОЛНИТЕЛЬНО ПРЕДЛАГАЕМ ПАРТНЕРСКУЮ ПРОШИВКУ ДЛЯ ВАШЕГО ОБОРУДОВАНИЯ!  - - - -  👉 ВНИМАНИЕ! Мы предоставляем услуги по размещению в собственном отеле 4.50 кВт/час (обслуживание, охрана, доступ 24/7 удалённо, бесперебойная работа под наблюдением специалистов и uptime 24/7).  👉 Сейчас свободно 700 кВат.  - - - -  Наши преимущества:  ↪ Работаем с 2019 года, все это время помогаем клиентам подобрать оборудование для добычи криптовалюты по самым низким ценам. Берем небольшую комиссию т.к работаем на объём. Предлагаем клиентам оформлять сборные заказы для максимальной выгоды. Работаем по всей России!  - - - -  📌Нажмите на профиль справа или внизу объявления. У нас широкий выбор оборудования для майнинга!  📌Будем рады помочь, ваш CryptoExpert.  ↙↙ Ниже топ 6 ↘↘",Воронеж,Воронеж,Воронежская область,102820.000000000000000,https://84.img.avito.st/640x480/11595762984.jpg,https://avito.ru/2225744775?utm_medium=cpc&avito_campaign_id=1232320950223423484&utm_source=buzzoola&utm_campaign=web_buzzoola_buyers_b2b_common_all_network_15082021_any_none_b2b,154893523,121823,"Lifestyles & Hobbies/Business Professionals,Beauty & Wellness/Frequently Visits Salons,Vehicles & Transportation/Auto Enthusiasts,Home & Garden/Do-It-Yourselfers"
2225747102,General,General.GoodsForBusiness,Оборудование для бизнеса,Другое,,,Asic Antminer l3,"Asic Antminer l3. Быстрая доставка из Китая до Москвы!🚀  💸Актуальные цены по запросу!  👍Все оборудование в комплекте с блоком питания  🚚Собственный офис в Шэньчжэнь, прямые поставки из Китая!  - - - -  ➡ Напишите нам &amp;#34;хочу прайс&amp;#34;.  ➡ Быстро отправим и добавим в наш чат WhatsApp / Telegram  ➡ По запросу отправим наш сайт и Телеграм канал  - - - -  • Предзаказ от лучшего поставщика из Китая  • Работаем по договору с физ и юр лицами  • Приветствуем личную встречу с клиентами  • Отправка в регионы  • Полная видео проверка перед отправкой из Китая!  - - - -  ⭐⭐⭐⭐⭐ Наш рейтинг на Авито 5.0  - - - -  📲Звоните/пишите прямо сейчас!  Добавляйте объявление в ❤Избранное, чтобы не потерять.  - - - -  💸Актуальные цены:  🔥От 5 шт - 75100  🔥От 10 шт - 73100  🔥От 20 шт - 68700  *Количество ограничено, цены меняются каждый день.  - - - -  💥ПОМОЖЕМ ПОДОБРАТЬ ЛЮБОЕ ИНТЕРЕСУЮЩИЕ ВАС ОБОРУДОВАНИЕ ПО САМЫМ ВЫГОДНЫМ ЦЕНАМ!  💥ДОПОЛНИТЕЛЬНО ПРЕДЛАГАЕМ ПАРТНЕРСКУЮ ПРОШИВКУ ДЛЯ ВАШЕГО ОБОРУДОВАНИЯ!  - - - -  👉 ВНИМАНИЕ! Мы предоставляем услуги по размещению в собственном отеле 4.50 кВт/час (обслуживание, охрана, доступ 24/7 удалённо, бесперебойная работа под наблюдением специалистов и uptime 24/7).  👉 Сейчас свободно 700 кВат.  - - - -  Наши преимущества:  ↪ Работаем с 2019 года, все это время помогаем клиентам подобрать оборудование для добычи криптовалюты по самым низким ценам. Берем небольшую комиссию т.к работаем на объём. Предлагаем клиентам оформлять сборные заказы для максимальной выгоды. Работаем по всей России!  - - - -  📌Нажмите на профиль справа или внизу объявления. У нас широкий выбор оборудования для майнинга!  📌Будем рады помочь, ваш CryptoExpert.  Энергопотребление: 806 W  Скорость: 558 Mh/s  Серийный номер: 4UGZT",Воронеж,Воронеж,Воронежская область,68700.000000000000000,https://54.img.avito.st/640x480/11727341254.jpg,https://avito.ru/2225747102?utm_medium=cpc&avito_campaign_id=1232320950223423484&utm_source=buzzoola&utm_campaign=web_buzzoola_buyers_b2b_common_all_network_15082021_any_none_b2b,154893523,121823,"Lifestyles & Hobbies/Business Professionals,Beauty & Wellness/Frequently Visits Salons,Vehicles & Transportation/Auto Enthusiasts,Home & Garden/Do-It-Yourselfers"
2183484672,General,General.GoodsForBusiness,Оборудование для бизнеса,Промышленное,,,Оборудование для производства воздуховодов (новое),"НОВАЯ автоматическая линия KKM для производства воздуховодов от официального дилера ООО КВСИСТЕМС. ЗВОНИТЕ!!!📞  💯 РАБОТАЕМ ПО ВСЕЙ РОССИИ! ОФИЦИАЛЬНАЯ ГАРАНТИЯ! ОБОРУДОВАНИЕ ОТ ЛУЧШИХ МИРОВЫХ ПРОИЗВОДИТЕЛЕЙ!  ✅ Характеристики:  - Ширина рулонного металла (мм): до 1250  - Толщина используемого металла (мм): 0,4 – 1,5  - Минимальный размер трубы (мм): 100х100  - Комплект: 2 неприводных разматывателя  ☎️ Позвольте нашим менеджерам подобрать оборудование именно под Ваш бизнес! ЗВОНИТЕ и они сориентируют Вас по оборудованию для производства вентиляционного оборудования, труб, дымоходов, водосточных систем, кровли﻿, фасадных кассет, линеарных панелей, металлических дверей, котлов, дорожных знаков и многих других изделий из листового металла. Ребята ПОДСКАЖУТ по аналогам выгодным именно Вам!  ✅ Также для Вас:  ▪️ помощь и профессиональная консультация в выборе станков, инструмента, оснастки  ▪️ подбор необходимого оборудования для комплектации цеха по производству готовых изделий  ▪️ содействие в запуске производства, настройка и пуско-наладка станков  ▪️ консультации по расширению и оптимизации вашего производства  ▪️ снабжение запасными частями и сервис в течение всего срока службы станка  Преимущества работы с нами:  🏆 Официальный дилер, более 10 лет опыта  🏭 Работаем с лучшими производителями мира  🛠️ Гарантийное и постгарантийное сервисное обслуживание  🤝 Различные формы оплаты  💳 Возможен КРЕДИТ или РАССРОЧКА  🏦 ЛИЗИНГ для компаний  🚚 доставка ПО ВСЕЙ РОССИИ!  👍 ГАРАНТИЯ на продукцию от 12 месяцев  🕑 Работаем с 09:00 до 20:00  Также есть возможность посещения нашего офиса в Москве! Позвоните, и мы подготовим для Вас предложение к приезду.  ☎️ЗВОНИТЕ и ПИШИТЕ (можно на WatsApp и Wiber)! С радостью ответим на все ваши вопросы!☎️",Воронеж,Воронеж,Воронежская область,2327940.000000000000000,https://61.img.avito.st/640x480/11665145061.jpg,https://avito.ru/2183484672?utm_medium=cpc&avito_campaign_id=1232320950223423484&utm_source=buzzoola&utm_campaign=web_buzzoola_buyers_b2b_common_all_network_15082021_any_none_b2b,92830185,121823,"Lifestyles & Hobbies/Business Professionals,Beauty & Wellness/Frequently Visits Salons,Vehicles & Transportation/Auto Enthusiasts,Home & Garden/Do-It-Yourselfers"
2225342867,General,General.GoodsForBusiness,Оборудование для бизнеса,Другое,,,Asic Antminer l3,"Asic Antminer l3. Быстрая доставка из Китая до Москвы!🚀  💸Актуальные цены по запросу!  👍Все оборудование в комплекте с блоком питания  🚚Собственный офис в Шэньчжэнь, прямые поставки из Китая!  - - - -  ➡ Напишите нам &amp;#34;хочу прайс&amp;#34;.  ➡ Быстро отправим и добавим в наш чат WhatsApp / Telegram  ➡ По запросу отправим наш сайт и Телеграм канал  - - - -  • Предзаказ от лучшего поставщика из Китая  • Работаем по договору с физ и юр лицами  • Приветствуем личную встречу с клиентами  • Отправка в регионы  • Полная видео проверка перед отправкой из Китая!  - - - -  ⭐⭐⭐⭐⭐ Наш рейтинг на Авито 5.0  - - - -  📲Звоните/пишите прямо сейчас!  Добавляйте объявление в ❤Избранное, чтобы не потерять.  - - - -  💸Актуальные цены:  🔥От 5 шт - 75100  🔥От 10 шт - 73100  🔥От 20 шт - 68700  *Количество ограничено, цены меняются каждый день.  - - - -  💥ПОМОЖЕМ ПОДОБРАТЬ ЛЮБОЕ ИНТЕРЕСУЮЩИЕ ВАС ОБОРУДОВАНИЕ ПО САМЫМ ВЫГОДНЫМ ЦЕНАМ!  💥ДОПОЛНИТЕЛЬНО ПРЕДЛАГАЕМ ПАРТНЕРСКУЮ ПРОШИВКУ ДЛЯ ВАШЕГО ОБОРУДОВАНИЯ!  - - - -  👉 ВНИМАНИЕ! Мы предоставляем услуги по размещению в собственном отеле 4.50 кВт/час (обслуживание, охрана, доступ 24/7 удалённо, бесперебойная работа под наблюдением специалистов и uptime 24/7).  👉 Сейчас свободно 700 кВат.  - - - -  Наши преимущества:  ↪ Работаем с 2019 года, все это время помогаем клиентам подобрать оборудование для добычи криптовалюты по самым низким ценам. Берем небольшую комиссию т.к работаем на объём. Предлагаем клиентам оформлять сборные заказы для максимальной выгоды. Работаем по всей России!  - - - -  📌Нажмите на профиль справа или внизу объявления. У нас широкий выбор оборудования для майнинга!  📌Будем рады помочь, ваш CryptoExpert.  Энергопотребление: 794 W  Скорость: 548 Mh/s  Серийный номер: 4PTEW",Воронеж,Воронеж,Воронежская область,68700.000000000000000,https://33.img.avito.st/640x480/11727319733.jpg,https://avito.ru/2225342867?utm_medium=cpc&avito_campaign_id=1232320950223423484&utm_source=buzzoola&utm_campaign=web_buzzoola_buyers_b2b_common_all_network_15082021_any_none_b2b,154893523,121823,"Lifestyles & Hobbies/Business Professionals,Beauty & Wellness/Frequently Visits Salons,Vehicles & Transportation/Auto Enthusiasts,Home & Garden/Do-It-Yourselfers"
2224982479,General,General.GoodsForBusiness,Оборудование для бизнеса,Другое,,,Asic Innosilicon A10 Pro 7Gb,"Asic Innosilicon A10 Pro 7Gb. Быстрая доставка из Китая до Москвы!🚀  💸Актуальные цены по запросу!  👍Все оборудование в комплекте с блоком питания  🚚Собственный офис в Шэньчжэнь, прямые поставки из Китая!  - - - -   ➡ Напишите нам &amp;#34;хочу прайс&amp;#34;.  ➡ Быстро отправим и добавим в наш чат WhatsApp / Telegram  ➡ По запросу отправим наш сайт и Телеграм канал  - - - -  • Предзаказ от лучшего поставщика из Китая  • Работаем по договору с физ и юр лицами  • Приветствуем личную встречу с клиентами  • Отправка в регионы  • Полная видео проверка перед отправкой из Китая!  - - - -  ⭐⭐⭐⭐⭐ Наш рейтинг на Авито 5.0  - - - -  📲Звоните/пишите прямо сейчас!  Добавляйте объявление в ❤Избранное, чтобы не потерять.  - - - -  💥ПОМОЖЕМ ПОДОБРАТЬ ЛЮБОЕ ИНТЕРЕСУЮЩИЕ ВАС ОБОРУДОВАНИЕ ПО САМЫМ ВЫГОДНЫМ ЦЕНАМ!  💥ДОПОЛНИТЕЛЬНО ПРЕДЛАГАЕМ ПАРТНЕРСКУЮ ПРОШИВКУ ДЛЯ ВАШЕГО ОБОРУДОВАНИЯ!  - - - -  👉 ВНИМАНИЕ! Мы предоставляем услуги по размещению в собственном отеле 4.50 кВт/час (обслуживание, охрана, доступ 24/7 удалённо, бесперебойная работа под наблюдением специалистов и uptime 24/7).  👉 Сейчас свободно 700 кВат.  - - - -  Наши преимущества:  ↪ Работаем с 2019 года, все это время помогаем клиентам подобрать оборудование для добычи криптовалюты по самым низким ценам. Берем небольшую комиссию т.к работаем на объём. Предлагаем клиентам оформлять сборные заказы для максимальной выгоды. Работаем по всей России!  - - - -  📌Нажмите на профиль справа или внизу объявления. У нас широкий выбор оборудования для майнинга!  📌Будем рады помочь, ваш CryptoExpert.  ↙↙ Ниже топ 6 ↘↘",Воронеж,Воронеж,Воронежская область,1183058.000000000000000,https://81.img.avito.st/640x480/11595757881.jpg,https://avito.ru/2224982479?utm_medium=cpc&avito_campaign_id=1232320950223423484&utm_source=buzzoola&utm_campaign=web_buzzoola_buyers_b2b_common_all_network_15082021_any_none_b2b,154893523,121823,"Lifestyles & Hobbies/Business Professionals,Beauty & Wellness/Frequently Visits Salons,Vehicles & Transportation/Auto Enthusiasts,Home & Garden/Do-It-Yourselfers"
