id,vertical,logical_category,subcategory,Param1,Param2,Param3,title,description,LocationName,city,region,price,image_url,url_item,ext_user_id,weborama_id,interests
2201407257,General,General.HealthAndBeauty,Красота и здоровье,Приборы и аксессуары,,,Аппарат для маникюра strong 210,"АППАРАТ СТРОНГ 210 ДЛЯ МАНИКЮРА И ПЕДИКЮРА  Аппарат Strong 210/105 для маникюра и педикюра   Аппарат Strong 210 / 105L предназначен для маникюра, педикюра и наращивания ногтей. Подходит как для работы в салоне с высокой посещаемостью клиентов, так и дома. Мощность микромотора станка 65 Вт, что дает возможность использовать его для маникюра и педикюра. Скорость вращения - 35000 об / мин, устройство имеет реверсивную функцию. В станке есть цанговый режим смены фрезы, что позволяет мастеру быстро и легко заменить насадку (затратив не более 3 секунд). Рукоятка не нагревается, благодаря специальному воздухозаборнику, который имеет наконечник аппарата Strоng.   Для удобства мастера на корпусе устройства располагается футляр для фрез, чтобы под рукой были самые необходимые насадки. Также полностью исключена вибрация станка при работе, так как в конструкции микромотора есть 4 подшипника, не допускающие вибрации фрезы.  МОЩНОСТЬ: 65 ватт  ОБОРОТОВ: 35000",Воронеж,Воронеж,Воронежская область,5990.000000000000000,https://01.img.avito.st/640x480/11661875901.jpg,https://avito.ru/2201407257?utm_medium=cpc&avito_campaign_id=1232320950223423484&utm_source=buzzoola&utm_campaign=web_buzzoola_buyers_b2b_common_all_network_15082021_any_none_b2b,173534363,121813,"Lifestyles & Hobbies/Business Professionals,Beauty & Wellness/Frequently Visits Salons,Sports & Fitness/Sports Fans,Green Living Enthusiasts,Home & Garden/Do-It-Yourselfers"
2223299534,General,General.HealthAndBeauty,Красота и здоровье,Парфюмерия,,,Парфюмерия набор Tom Ford 4 шт по 30 мл,"Селективный наборчик для женщин и мужчин от Tom Ford. 4 шт по 30 мл, невероятно выгодный формат!  🙋🏼‍♀️ Дорогие друзья, гарантирую Высокое качество парфюмерии, при самой самой не прилично низкой цене!!!  💎 Гарантирую Оригинальное качество!  🖤 Загляните в мой профиль, подпишись, что б не пропусть модные новинки и самые выгодные распродажи!   📸 Все фото сделаны мною лично для Вас!   🎁 Все новое, идеально подходит в качестве подарка, в слюде и упаковке, брендовых пакетах, коробочках  ❗Есть инстагра vrn_parfum_136   🚚Доставка в течении часа по Воронежу!   📦Пересыл по Всей Стране!   🔥Всех моих покупателей ждут скидки, подарки, приятные сюрпризы!",Воронеж,Воронеж,Воронежская область,2490.000000000000000,https://73.img.avito.st/640x480/11770712873.jpg,https://avito.ru/2223299534?utm_medium=cpc&avito_campaign_id=1232320950223423484&utm_source=buzzoola&utm_campaign=web_buzzoola_buyers_b2b_common_all_network_15082021_any_none_b2b,174976049,121813,"Lifestyles & Hobbies/Business Professionals,Beauty & Wellness/Frequently Visits Salons,Sports & Fitness/Sports Fans,Green Living Enthusiasts,Home & Garden/Do-It-Yourselfers"
2190961019,General,General.HealthAndBeauty,Красота и здоровье,Косметика,,,"Блеск для губ Tom Ford, помада","🙋🏼‍♀️ Дорогие друзья, гарантирую Высокое качество, при самой самой не прилично низкой цене!!!  💎 Гарантирую Оригинальное качество!  🖤 Загляните в мой профиль, подпишись, что б не пропусть модные новинки и самые выгодные распродажи!   📸 Все фото сделаны мною лично для Вас!   🎁 Все новое, идеально подходит в качестве подарка, в слюде и упаковке, брендовых пакетах, коробочках   У новинки комфортная и нелипкая текстура жидкого бальзама и сияющий блеск. В составе содержится 3 масла — авокадо, оливковое и жожоба, питающие и увлажняющие губы, а также специальная пудра, придающая воздушность текстуре.  ❗Есть инстагра vrn_parfum_136   🚚Доставка в течении часа по Воронежу!   📦Пересыл по Всей Стране!   🔥Всех моих покупателей ждут скидки, подарки, приятные сюрпризы!",Воронеж,Воронеж,Воронежская область,500.000000000000000,https://12.img.avito.st/640x480/11756975612.jpg,https://avito.ru/2190961019?utm_medium=cpc&avito_campaign_id=1232320950223423484&utm_source=buzzoola&utm_campaign=web_buzzoola_buyers_b2b_common_all_network_15082021_any_none_b2b,174976049,121813,"Lifestyles & Hobbies/Business Professionals,Beauty & Wellness/Frequently Visits Salons,Sports & Fitness/Sports Fans,Green Living Enthusiasts,Home & Garden/Do-It-Yourselfers"
2201846579,General,General.HealthAndBeauty,Красота и здоровье,Приборы и аксессуары,,,Фрезер 45.000 об 65 вват,"АППАРАТ ZS-602 ДЛЯ МАНИКЮРА И ПЕДИКЮРА  Аппарат для маникюра и педикюра ZS-602 Nail Drill Pro имеет достаточно сильную фактическую мощность 65 Вт, поэтому он идеально подходит как для маникюра, обеспечивая профессиональную обработку кутикулы, боковых выступов, кончиков пальцев, так и для педикюра в процессе обработки натоптышей. и ороговевшая кожа.   Максимальная частота вращения фрезы 45 000 об / мин. Модель отличается компактностью, лаконичным дизайном и всеми необходимыми функциями. Маршрутизатором можно управлять как вручную, так и с помощью специальной педали. Подставка для ручки роутера и насадки - дополнительный комфорт для мастера. Также есть отверстия для фрезы.   Устройство работает на разных скоростях от минимальной 0 до максимальной 45 000 об / мин. Плавный переход скоростей осуществляется ручкой на передней панели устройства или ножной педалью. Фрезер отлично подходит для аппаратного маникюра, коррекции верхних ногтей (гель и акрил). Имеет низкий уровень шума при работе, не вибрирует. Встроенный предохранитель защищает от перегрузки. Маникюрный аппарат ZS-602 надежен и долговечен. Подходит для домашнего использования.  МОЩНОСТЬ: 65 ватт  ОБОРОТОВ: 45 000  ЦЕНА: 2700₽",Воронеж,Воронеж,Воронежская область,2700.000000000000000,https://77.img.avito.st/640x480/11661886577.jpg,https://avito.ru/2201846579?utm_medium=cpc&avito_campaign_id=1232320950223423484&utm_source=buzzoola&utm_campaign=web_buzzoola_buyers_b2b_common_all_network_15082021_any_none_b2b,173534363,121813,"Lifestyles & Hobbies/Business Professionals,Beauty & Wellness/Frequently Visits Salons,Sports & Fitness/Sports Fans,Green Living Enthusiasts,Home & Garden/Do-It-Yourselfers"
2233368097,General,General.HealthAndBeauty,Красота и здоровье,Приборы и аксессуары,,,Стартовый набор оборудования,"Большой ассортимент товаров для маникюра по оптовым ценам.  Гарантия низкой цены!!!  В набор входит:  Лампа sun 5 48w  Аппарат Nail Mastre 65W. 45000 об/мин. реверс, педаль, 6 фрез  Пылесос Smart 80W с регулировкой скорости, мешок для пыли  Лампа настольная для бликов 60 см. Е27",Воронеж,Воронеж,Воронежская область,6990.000000000000000,https://73.img.avito.st/640x480/11792029173.jpg,https://avito.ru/2233368097?utm_medium=cpc&avito_campaign_id=1232320950223423484&utm_source=buzzoola&utm_campaign=web_buzzoola_buyers_b2b_common_all_network_15082021_any_none_b2b,173534363,121813,"Lifestyles & Hobbies/Business Professionals,Beauty & Wellness/Frequently Visits Salons,Sports & Fitness/Sports Fans,Green Living Enthusiasts,Home & Garden/Do-It-Yourselfers"
2191167526,General,General.HealthAndBeauty,Красота и здоровье,Парфюмерия,,,Kenzo L&apos;Eau Par Pour Femme Туалетная вода,"🙋🏼‍♀️ Дорогие друзья, гарантирую Высокое качество парфюмерии, при самой самой не прилично низкой цене!!!  💎 Гарантирую Оригинальное качество!  🖤 Загляните в мой профиль, подпишись, что б не пропусть модные новинки и самые выгодные распродажи!   📸 Все фото сделаны мною лично для Вас!   🎁 Все новое, идеально подходит в качестве подарка, в слюде и упаковке, брендовых пакетах, коробочках  Розовый перец, Мята, Тростник, Мандарин, Роза, Перец, Кувшинка, Фиалка, Амариллис, Ваниль   ❗Есть инстагра vrn_parfum_136   🚚Доставка в течении часа по Воронежу!   📦Пересыл по Всей Стране!   🔥Всех моих покупателей ждут скидки, подарки, приятные сюрпризы!",Воронеж,Воронеж,Воронежская область,2000.000000000000000,https://02.img.avito.st/640x480/11746519402.jpg,https://avito.ru/2191167526?utm_medium=cpc&avito_campaign_id=1232320950223423484&utm_source=buzzoola&utm_campaign=web_buzzoola_buyers_b2b_common_all_network_15082021_any_none_b2b,174976049,121813,"Lifestyles & Hobbies/Business Professionals,Beauty & Wellness/Frequently Visits Salons,Sports & Fitness/Sports Fans,Green Living Enthusiasts,Home & Garden/Do-It-Yourselfers"
2191712200,General,General.HealthAndBeauty,Красота и здоровье,Косметика,,,Тушь для ресниц Армани с зеркальцем новая,"Новая  🧚Дорогие друзья, Гарантирую высокое качество по самой низкой цене!  📸 Все Фото в профиле сделаны мною лично для Вас! Большой ассортимент в наличии!  ☑️Есть пакеты брендовых магазинов идеально в качестве подарков на Новый год!  ☑️ Гарантия Высочайшего Качества и самой выгодной цены!  ⚡⚡⚡⚡⚡⚡⚡⚡⚡⚡⚡⚡  ❗Есть инстаграм vrn_parfum_136  🚚 Осуществляем экспресс доставку и пересыл по всей стране!",Воронеж,Воронеж,Воронежская область,500.000000000000000,https://76.img.avito.st/640x480/11746127576.jpg,https://avito.ru/2191712200?utm_medium=cpc&avito_campaign_id=1232320950223423484&utm_source=buzzoola&utm_campaign=web_buzzoola_buyers_b2b_common_all_network_15082021_any_none_b2b,174976049,121813,"Lifestyles & Hobbies/Business Professionals,Beauty & Wellness/Frequently Visits Salons,Sports & Fitness/Sports Fans,Green Living Enthusiasts,Home & Garden/Do-It-Yourselfers"
2223487304,General,General.HealthAndBeauty,Красота и здоровье,Парфюмерия,,,"Baccarat rouge 540 отливант, распив, парфюм селект","🙋🏼‍♀️ Дорогие друзья, гарантирую Высокое качество парфюмерии, при самой самой не прилично низкой цене!!!  цена 2мл 140р  5 мл 350р  10мл 700 р  15мл 950 р  Цена с учётом атомайзера!  💎 Гарантирую Оригинальное качество!  🖤 Загляните в мой профиль, подпишись, что б не пропусть модные новинки и самые выгодные распродажи!   📸 Все фото сделаны мною лично для Вас!   ‼️Распив, продажа по милилитрам, это прекрасная возможность попробовать и разносить селектив на себе!А так же самая выгодная цена полным флаконом 100 мл! Или остатком во флаконе!  🎁 Все новое, идеально подходит в качестве подарка, в слюде и упаковке, брендовых пакетах, коробочках   Композиция предназначена для мужчин и женщин, чья любовь к роскоши соблюдается во всем. Насыщенные ноты цветочно-травяного жасмина открывают верхние аккорды. Мелодия бархатного цветка переплетается с острым, древесно-сладким и сандаловым шафраном. Ароматное пряное облако растворяется на плечах обладателя, превращаясь в шлейф из обволакивающего, томного и согревающего древесного янтаря. Его сладкое тепло подчеркивает благородный и изысканный фиксатор в виде амбры. В базе сочетаются интенсивная и бальзамическая еловая смола с хвойной древесиной белого кедра.    ❗Есть инстагра vrn_parfum_136   🚚Доставка в течении часа по Воронежу!   📦Пересыл по Всей Стране!   🔥Всех моих покупателей ждут скидки, подарки, приятные сюрпризы!",Воронеж,Воронеж,Воронежская область,350.000000000000000,https://06.img.avito.st/640x480/11770525606.jpg,https://avito.ru/2223487304?utm_medium=cpc&avito_campaign_id=1232320950223423484&utm_source=buzzoola&utm_campaign=web_buzzoola_buyers_b2b_common_all_network_15082021_any_none_b2b,174976049,121813,"Lifestyles & Hobbies/Business Professionals,Beauty & Wellness/Frequently Visits Salons,Sports & Fitness/Sports Fans,Green Living Enthusiasts,Home & Garden/Do-It-Yourselfers"
2223295395,General,General.HealthAndBeauty,Красота и здоровье,Парфюмерия,,,Духи JO malone blackberry &amp; BAY Ежевика,"🙋🏼‍♀️ Дорогие друзья, гарантирую Высокое качество парфюмерии, при самой самой не прилично низкой цене!!!  💎 Гарантирую Оригинальное качество!  🖤 Загляните в мой профиль, подпишись, что б не пропусть модные новинки и самые выгодные распродажи!   📸 Все фото сделаны мною лично для Вас!   🎁 Все новое, идеально подходит в качестве подарка, в слюде и упаковке, брендовых пакетах, коробочках   🧤Возможен распив 2 мл, 5 мл, 10 мл, уточняйте.   Это бодрящий живой аромат, который никого не сможет оставить равнодушным, поскольку удивительным образом сочетает в себе легкость, воздушность, неповторимую нежность и солнечную искристость. Парфюм передает настроение праздника, счастье и летнюю энергетику, которая не может не радовать своей сладостью и благоухающей цветочной нежностью. Парфюмерный изыск становится примером современного взгляда на женственность и очарование, он привлекает внимание удивительной цветочно-фруктовой аурой, которая обволакивает тонким палантином, скрывая от посторонних глаз некоторые недостатки, подчеркивая достоинства красавицы. Классическую элегантность аромата передает также его фантастически лаконичный флакон, который несет в себе безмолвный призыв к содержимому.   ❗Есть инстагра vrn_parfum_136   🚚Доставка в течении часа по Воронежу!   📦Пересыл по Всей Стране!   🔥Всех моих покупателей ждут скидки, подарки, приятные сюрпризы!",Воронеж,Воронеж,Воронежская область,1990.000000000000000,https://41.img.avito.st/640x480/11764276741.jpg,https://avito.ru/2223295395?utm_medium=cpc&avito_campaign_id=1232320950223423484&utm_source=buzzoola&utm_campaign=web_buzzoola_buyers_b2b_common_all_network_15082021_any_none_b2b,174976049,121813,"Lifestyles & Hobbies/Business Professionals,Beauty & Wellness/Frequently Visits Salons,Sports & Fitness/Sports Fans,Green Living Enthusiasts,Home & Garden/Do-It-Yourselfers"
2230897200,General,General.HealthAndBeauty,Красота и здоровье,Косметика,,,Тайская традиционная мазь «Кулаб»,"🌞Доброго времени суток 🌞  Благодарим за внимание к продукции магазинов Красоты и Здоровья «Восточный Бриз»  Только 100% оригинальная продукция!  Опт и розница.  Тайская традиционная мазь от кожных заболеваний и грибка, «Кулаб» (Таиланд)  Мазь «Кулаб» от кожных заболеваний – народное тайское средство, цель которого – лечение грибка и очищение от этой болезни ногтей полностью.  Помогает при следующих проблемах:  Грибковые заболевания кожи и ступней ног, Грибковые заболевания ногтей,  Кожный зуд, Чесотка, Дерматомикоз, Экзема, Псориаз, Герпес, Трещины на пятках, Рак кожи.  Состав тайской целебной мази «Кулаб» от микозов на стопах и ногтях запатентован, полностью натурален и не наносит вред здоровью.  Это чудесное средство лечит сразу все пораженные зоны: грибок ногтей, стопы и пальцев ног. Оно экономично и его хватает не только на весь курс лечения, но и на дальнейшую профилактику.  Способ изготовления примочек при лечении грибка ногтей:  Подстричь ногти максимально коротко.  Нанести мазь «Кулаб» на кусочек ваты и зафиксировать с помощью лейкопластыря на больном ногте  Необходимое время выдержки составляет 10 - 30 минут.  Если вдруг после снятия примочки на ногтях появились выделения – их следует удалить чистым ватным тампоном.  Нужно проделывать эту процедуру каждый день до тех пор, пока полностью не обновится структура ногтя.  После такого лечения, для закрепления результата, нужно тампоном с мазью «Кулаб» протирать пораженные участки тела на протяжении двух недель.  Данное средство от грибка стоп и ногтей можно применять и в профилактических целях – после посещения бани, бассейна и прочих общественных мест, где приходится снимать обувь, ходить босиком или надевать чужие тапочки.  При грибке на коже способ применения аналогичен. Делать примочки и мазать пораженные участки тела мазью «Кулаб» каждый день.  Всегда в наличии и другие аналогичные товары, с которыми Вы можете ознакомиться в нашем профиле.  🚚✈️Доставка:  Челябинск, Копейск через Яндекс-Доставку  Минимальный заказ 500р+доставка.  После 100% предоплаты формируем заказ и отправляем в этот же день, либо наследующий.  ======================================================  РФ отправляем почтой(300-450р) и ТК Сдэк(200-400р)  Минимальный заказ 1000р+доставка.  После 100% предоплаты формируем заказ и отправляем в течении 3-х рабочих дней.  Доверяйте ТОЛЬКО проверенным и надежным продавцам!",Воронеж,Воронеж,Воронежская область,79.000000000000000,https://17.img.avito.st/640x480/11700818817.jpg,https://avito.ru/2230897200?utm_medium=cpc&avito_campaign_id=1232320950223423484&utm_source=buzzoola&utm_campaign=web_buzzoola_buyers_b2b_common_all_network_15082021_any_none_b2b,147687033,121813,"Lifestyles & Hobbies/Business Professionals,Beauty & Wellness/Frequently Visits Salons,Sports & Fitness/Sports Fans,Green Living Enthusiasts,Home & Garden/Do-It-Yourselfers"
