id,vertical,logical_category,subcategory,Param1,Param2,Param3,title,description,LocationName,city,region,price,image_url,url_item,ext_user_id,weborama_id,interests
2215767684,General,General.GoodsForBusiness,Оборудование для бизнеса,Промышленное,,,Кровельный станок (новый),"НОВЫЙ фальцепрокатный станок СФП-700 для фальцевой кровли от официального дилера ООО КВСИСТЕМС. ЗВОНИТЕ!!!📞  💯 РАБОТАЕМ ПО ВСЕЙ РОССИИ! ОФИЦИАЛЬНАЯ ГАРАНТИЯ! ОБОРУДОВАНИЕ ОТ ЛУЧШИХ МИРОВЫХ ПРОИЗВОДИТЕЛЕЙ!  ✅ Характеристики:  - ширина материала (мм) — 250-700  - толщина материала (мм) — 0.45-0.7  - высота фальца (мм) — 25  - скорость проката — 6 метров в минуту  - работа с любым типом кровельного металла: оцинковка, цинк-титан, медь в том числе патинированная, алюминий или пурал (не царапает и не оставляет потёртостей)  - вес (кг): 180  ☎️ Позвольте нашим менеджерам подобрать оборудование именно под Ваш бизнес! ЗВОНИТЕ и они сориентируют Вас по оборудованию для производства вентиляционного оборудования, труб, дымоходов, водосточных систем, кровли﻿, фасадных кассет, линеарных панелей, металлических дверей, котлов, дорожных знаков и многих других изделий из листового металла. Ребята ПОДСКАЖУТ по аналогам выгодным именно Вам!  ✅ Также для Вас:  ▪️ помощь и профессиональная консультация в выборе станков, инструмента, оснастки  ▪️ подбор необходимого оборудования для комплектации цеха по производству готовых изделий  ▪️ содействие в запуске производства, настройка и пуско-наладка станков  ▪️ консультации по расширению и оптимизации вашего производства  ▪️ снабжение запасными частями и сервис в течение всего срока службы станка  Преимущества работы с нами:  🏆 Официальный дилер, более 10 лет опыта  🏭 Работаем с лучшими производителями мира  🛠️ Гарантийное и постгарантийное сервисное обслуживание  🤝 Различные формы оплаты  💳 Возможен КРЕДИТ или РАССРОЧКА  🏦 ЛИЗИНГ для компаний  🚚 доставка ПО ВСЕЙ РОССИИ!  👍 ГАРАНТИЯ на продукцию от 12 месяцев  🕑 Работаем с 09:00 до 20:00  Также есть возможность посещения нашего офиса в Москве или демо-зала! Позвоните, и мы подготовим для Вас предложение к приезду.  ☎️ЗВОНИТЕ и ПИШИТЕ (можно на WatsApp и Viber)! С радостью ответим на все ваши вопросы!☎️",Воронеж,Воронеж,Воронежская область,249000.000000000000000,https://32.img.avito.st/640x480/11756208732.jpg,https://avito.ru/2215767684?utm_medium=cpc&avito_campaign_id=1232320950223423484&utm_source=buzzoola&utm_campaign=web_buzzoola_buyers_b2b_common_all_network_15082021_any_none_b2b,92830185,121823,"Lifestyles & Hobbies/Business Professionals,Beauty & Wellness/Frequently Visits Salons,Vehicles & Transportation/Auto Enthusiasts,Home & Garden/Do-It-Yourselfers"
2211654208,General,General.GoodsForBusiness,Оборудование для бизнеса,Промышленное,,,Садовый измельчитель веток,"Садовый измельчитель веток &quot;ТЕРМИТ&quot; У250 с электрическим двигателем 2.2 кВт (бытовая сеть 220В) напрямую от ИЗГОТОВИТЕЛЯ.  — Гарантия безопасной сделки: предоплата при заказе 2 000 рублей, остальная сумма при осмотре и получении! — Опыт производства измельчителей более 7 лет! — Гарантия на садовый измельчитель до 2 лет!  Звоните или пишите в сообщении, и мы более подробно расскажем про преимущества нашего оборудования!  Измельчитель веток с легкостью перерабатывает ветки до 5х5 см. Отлично подойдет для измельчения веток в саду, а также:  — Для переработки древесных отходов (срезки, кустарники) — Для получения щепы для копчения (яблоня, груша, вишня, ольха)  Технические характеристики  1. Мощность 2,2 кВт (бытовая сеть 220В) или 380В  2. Габаритные размеры 0,400×0,600×0,450 мм  3. Масса 46 кг  4. Производительность 1 м3/ч  5. Диаметр маховика 250 мм  6. Количество ножей 2 шт. из легированной стали 9ХС + термозакалка (можно регулировать вылет ножей и щепу на выходе)  7. Размер приёмного окна 60х60 мм  8. Назначение щепы: мульча, щепа под копчение.  9. Средняя фракция щепы (настраивается) т 4-7, ш 5-7, д 25-40 мм  Стоимость и комплектации:  — с электро двигателем мощностью 2.2 кВт в сборе: цена 34 т.р.  — с бензиновым двигателем мощностью 6,5 л.с. в сборе:цена 38 т.р. 4. дополнительный комплект режущих ножей: цена 3 т.р.  ------------------------ НАШИ ПРЕИМУЩЕСТВА:  ✅ Мы сами завод-изготовитель, поэтому мы может предложить минимальные цены для наших покупателей минуя посредников.  ✅ Расходные материалы всегда в наличие – вы можете заказать необходимые запасные части в любой момент, так как они всегда в наличие.  ------------------------  ☎️ ЗВОНИТЕ прямо сейчас и наши сотрудники помогут с выбором.  📨 ПИШИТЕ нам на почту, мы подберем для Вас выгодное предложение  📌 Добавляйте объявление в ИЗБРАННОЕ, чтобы не потерять 👉 Переходите в наш ПРОФИЛЬ и смотрите весь ассортимент  Также у нас найдёте: щепорез, дробилку, веткоруб, веткорез, сучкорез, измельчитель веток, мульчер, мельчитель",Воронеж,Воронеж,Воронежская область,34000.000000000000000,https://31.img.avito.st/640x480/11748470831.jpg,https://avito.ru/2211654208?utm_medium=cpc&avito_campaign_id=1232320950223423484&utm_source=buzzoola&utm_campaign=web_buzzoola_buyers_b2b_common_all_network_15082021_any_none_b2b,79166661,121823,"Lifestyles & Hobbies/Business Professionals,Beauty & Wellness/Frequently Visits Salons,Vehicles & Transportation/Auto Enthusiasts,Home & Garden/Do-It-Yourselfers"
2215230600,General,General.GoodsForBusiness,Оборудование для бизнеса,Промышленное,,,"Сегментный листогиб, листогибочный станок (новый)","НОВЫЙ сегментный листогибочный станок с ножным приводом PBB 1270/2 для изготовления различных изделий из листовых материалов (гибка изделий с бортами) от официального дилера ООО КВСИСТЕМС. ЗВОНИТЕ!!!📞  💯 РАБОТАЕМ ПО ВСЕЙ РОССИИ! ОФИЦИАЛЬНАЯ ГАРАНТИЯ! ОБОРУДОВАНИЕ ОТ ЛУЧШИХ МИРОВЫХ ПРОИЗВОДИТЕЛЕЙ!  ✅ Характеристики:  - рабочая длина (мм): 1270  - максимальная толщина металла (мм): 2,0  - максимальный угол гиба: 135 град.  - имеет 12 сегментов различных размеров: 25 мм, 30 мм, 35 мм, 40 мм, 45 мм, 50 мм, 75 мм, 100 мм, 150 мм, 200 мм, 250 мм, 270 мм.  - вес (кг): 320  - ножная педаль привода прижимной банки позволяет освободить руки жестянщика и позиционировать заготовку точно по меткам  - легкая работа даже с 2-кой благодаря мощному амортизатору на гибочной балке  ☎️ Позвольте нашим менеджерам подобрать оборудование именно под Ваш бизнес! ЗВОНИТЕ и они сориентируют Вас по оборудованию для производства вентиляционного оборудования, труб, дымоходов, водосточных систем, кровли﻿, фасадных кассет, линеарных панелей, металлических дверей, котлов, дорожных знаков и многих других изделий из листового металла. Ребята ПОДСКАЖУТ по аналогам выгодным именно Вам!  ✅ Также для Вас:  ▪️ помощь и профессиональная консультация в выборе станков, инструмента, оснастки  ▪️ подбор необходимого оборудования для комплектации цеха по производству готовых изделий  ▪️ содействие в запуске производства, настройка и пуско-наладка станков  ▪️ консультации по расширению и оптимизации вашего производства  ▪️ снабжение запасными частями и сервис в течение всего срока службы станка  Преимущества работы с нами:  🏆 Официальный дилер, более 10 лет опыта  🏭 Работаем с лучшими производителями мира  🛠️ Гарантийное и постгарантийное сервисное обслуживание  🤝 Различные формы оплаты  💳 Возможен КРЕДИТ или РАССРОЧКА  🏦 ЛИЗИНГ для компаний  🚚 доставка ПО ВСЕЙ РОССИИ!  👍 ГАРАНТИЯ на продукцию от 12 месяцев  🕑 Работаем с 09:00 до 20:00  Также есть возможность посещения нашего офиса в Москве или демо-зала! Позвоните, и мы подготовим для Вас предложение к приезду.  ☎️ЗВОНИТЕ и ПИШИТЕ (можно на WatsApp и Wiber)! С радостью ответим на все ваши вопросы!☎️",Воронеж,Воронеж,Воронежская область,138004.000000000000000,https://41.img.avito.st/640x480/11724593441.jpg,https://avito.ru/2215230600?utm_medium=cpc&avito_campaign_id=1232320950223423484&utm_source=buzzoola&utm_campaign=web_buzzoola_buyers_b2b_common_all_network_15082021_any_none_b2b,92830185,121823,"Lifestyles & Hobbies/Business Professionals,Beauty & Wellness/Frequently Visits Salons,Vehicles & Transportation/Auto Enthusiasts,Home & Garden/Do-It-Yourselfers"
2225267146,General,General.GoodsForBusiness,Оборудование для бизнеса,Другое,,,Asic Antminer Z11 135 kSol с бп,"Asic Antminer Z11 135 kSol с БП. Быстрая доставка из Китая до Москвы!🚀  💸Актуальные цены по запросу!  👍Все оборудование в комплекте с блоком питания  🚚Собственный офис в Шэньчжэнь, прямые поставки из Китая!  - - - -   ➡ Напишите нам &amp;#34;хочу прайс&amp;#34;.  ➡ Быстро отправим и добавим в наш чат WhatsApp / Telegram  ➡ По запросу отправим наш сайт и Телеграм канал  - - - -  • Предзаказ от лучшего поставщика из Китая  • Работаем по договору с физ и юр лицами  • Приветствуем личную встречу с клиентами  • Отправка в регионы  • Полная видео проверка перед отправкой из Китая!  - - - -  ⭐⭐⭐⭐⭐ Наш рейтинг на Авито 5.0  - - - -  📲Звоните/пишите прямо сейчас!  Добавляйте объявление в ❤Избранное, чтобы не потерять.  - - - -  💥ПОМОЖЕМ ПОДОБРАТЬ ЛЮБОЕ ИНТЕРЕСУЮЩИЕ ВАС ОБОРУДОВАНИЕ ПО САМЫМ ВЫГОДНЫМ ЦЕНАМ!  💥ДОПОЛНИТЕЛЬНО ПРЕДЛАГАЕМ ПАРТНЕРСКУЮ ПРОШИВКУ ДЛЯ ВАШЕГО ОБОРУДОВАНИЯ!  - - - -  👉 ВНИМАНИЕ! Мы предоставляем услуги по размещению в собственном отеле 4.50 кВт/час (обслуживание, охрана, доступ 24/7 удалённо, бесперебойная работа под наблюдением специалистов и uptime 24/7).  👉 Сейчас свободно 700 кВат.  - - - -  Наши преимущества:  ↪ Работаем с 2019 года, все это время помогаем клиентам подобрать оборудование для добычи криптовалюты по самым низким ценам. Берем небольшую комиссию т.к работаем на объём. Предлагаем клиентам оформлять сборные заказы для максимальной выгоды. Работаем по всей России!  - - - -  📌Нажмите на профиль справа или внизу объявления. У нас широкий выбор оборудования для майнинга!  📌Будем рады помочь, ваш CryptoExpert.  ↙↙ Ниже топ 6 ↘↘",Воронеж,Воронеж,Воронежская область,125557.000000000000000,https://89.img.avito.st/640x480/11595751089.jpg,https://avito.ru/2225267146?utm_medium=cpc&avito_campaign_id=1232320950223423484&utm_source=buzzoola&utm_campaign=web_buzzoola_buyers_b2b_common_all_network_15082021_any_none_b2b,154893523,121823,"Lifestyles & Hobbies/Business Professionals,Beauty & Wellness/Frequently Visits Salons,Vehicles & Transportation/Auto Enthusiasts,Home & Garden/Do-It-Yourselfers"
2225346666,General,General.GoodsForBusiness,Оборудование для бизнеса,Другое,,,Asic Antminer l3,"Asic Antminer l3. Быстрая доставка из Китая до Москвы!🚀  💸Актуальные цены по запросу!  👍Все оборудование в комплекте с блоком питания  🚚Собственный офис в Шэньчжэнь, прямые поставки из Китая!  - - - -  ➡ Напишите нам &amp;#34;хочу прайс&amp;#34;.  ➡ Быстро отправим и добавим в наш чат WhatsApp / Telegram  ➡ По запросу отправим наш сайт и Телеграм канал  - - - -  • Предзаказ от лучшего поставщика из Китая  • Работаем по договору с физ и юр лицами  • Приветствуем личную встречу с клиентами  • Отправка в регионы  • Полная видео проверка перед отправкой из Китая!  - - - -  ⭐⭐⭐⭐⭐ Наш рейтинг на Авито 5.0  - - - -  📲Звоните/пишите прямо сейчас!  Добавляйте объявление в ❤Избранное, чтобы не потерять.  - - - -  💸Актуальные цены:  🔥От 5 шт - 75100  🔥От 10 шт - 73100  🔥От 20 шт - 68700  *Количество ограничено, цены меняются каждый день.  - - - -  💥ПОМОЖЕМ ПОДОБРАТЬ ЛЮБОЕ ИНТЕРЕСУЮЩИЕ ВАС ОБОРУДОВАНИЕ ПО САМЫМ ВЫГОДНЫМ ЦЕНАМ!  💥ДОПОЛНИТЕЛЬНО ПРЕДЛАГАЕМ ПАРТНЕРСКУЮ ПРОШИВКУ ДЛЯ ВАШЕГО ОБОРУДОВАНИЯ!  - - - -  👉 ВНИМАНИЕ! Мы предоставляем услуги по размещению в собственном отеле 4.50 кВт/час (обслуживание, охрана, доступ 24/7 удалённо, бесперебойная работа под наблюдением специалистов и uptime 24/7).  👉 Сейчас свободно 700 кВат.  - - - -  Наши преимущества:  ↪ Работаем с 2019 года, все это время помогаем клиентам подобрать оборудование для добычи криптовалюты по самым низким ценам. Берем небольшую комиссию т.к работаем на объём. Предлагаем клиентам оформлять сборные заказы для максимальной выгоды. Работаем по всей России!  - - - -  📌Нажмите на профиль справа или внизу объявления. У нас широкий выбор оборудования для майнинга!  📌Будем рады помочь, ваш CryptoExpert.  Энергопотребление: 782 W  Скорость: 536 Mh/s  Серийный номер: LR2K6",Воронеж,Воронеж,Воронежская область,68700.000000000000000,https://80.img.avito.st/640x480/11727319780.jpg,https://avito.ru/2225346666?utm_medium=cpc&avito_campaign_id=1232320950223423484&utm_source=buzzoola&utm_campaign=web_buzzoola_buyers_b2b_common_all_network_15082021_any_none_b2b,154893523,121823,"Lifestyles & Hobbies/Business Professionals,Beauty & Wellness/Frequently Visits Salons,Vehicles & Transportation/Auto Enthusiasts,Home & Garden/Do-It-Yourselfers"
2225601093,General,General.GoodsForBusiness,Оборудование для бизнеса,Другое,,,Asic Antminer l3,"Asic Antminer l3. Быстрая доставка из Китая до Москвы!🚀  💸Актуальные цены по запросу!  👍Все оборудование в комплекте с блоком питания  🚚Собственный офис в Шэньчжэнь, прямые поставки из Китая!  - - - -  ➡ Напишите нам &amp;#34;хочу прайс&amp;#34;.  ➡ Быстро отправим и добавим в наш чат WhatsApp / Telegram  ➡ По запросу отправим наш сайт и Телеграм канал  - - - -  • Предзаказ от лучшего поставщика из Китая  • Работаем по договору с физ и юр лицами  • Приветствуем личную встречу с клиентами  • Отправка в регионы  • Полная видео проверка перед отправкой из Китая!  - - - -  ⭐⭐⭐⭐⭐ Наш рейтинг на Авито 5.0  - - - -  📲Звоните/пишите прямо сейчас!  Добавляйте объявление в ❤Избранное, чтобы не потерять.  - - - -  💸Актуальные цены:  🔥От 5 шт - 75100  🔥От 10 шт - 73100  🔥От 20 шт - 68700  *Количество ограничено, цены меняются каждый день.  - - - -  💥ПОМОЖЕМ ПОДОБРАТЬ ЛЮБОЕ ИНТЕРЕСУЮЩИЕ ВАС ОБОРУДОВАНИЕ ПО САМЫМ ВЫГОДНЫМ ЦЕНАМ!  💥ДОПОЛНИТЕЛЬНО ПРЕДЛАГАЕМ ПАРТНЕРСКУЮ ПРОШИВКУ ДЛЯ ВАШЕГО ОБОРУДОВАНИЯ!  - - - -  👉 ВНИМАНИЕ! Мы предоставляем услуги по размещению в собственном отеле 4.50 кВт/час (обслуживание, охрана, доступ 24/7 удалённо, бесперебойная работа под наблюдением специалистов и uptime 24/7).  👉 Сейчас свободно 700 кВат.  - - - -  Наши преимущества:  ↪ Работаем с 2019 года, все это время помогаем клиентам подобрать оборудование для добычи криптовалюты по самым низким ценам. Берем небольшую комиссию т.к работаем на объём. Предлагаем клиентам оформлять сборные заказы для максимальной выгоды. Работаем по всей России!  - - - -  📌Нажмите на профиль справа или внизу объявления. У нас широкий выбор оборудования для майнинга!  📌Будем рады помочь, ваш CryptoExpert.  Энергопотребление: 798 W  Скорость: 552 Mh/s  Серийный номер: X06SG",Воронеж,Воронеж,Воронежская область,68700.000000000000000,https://43.img.avito.st/640x480/11727320643.jpg,https://avito.ru/2225601093?utm_medium=cpc&avito_campaign_id=1232320950223423484&utm_source=buzzoola&utm_campaign=web_buzzoola_buyers_b2b_common_all_network_15082021_any_none_b2b,154893523,121823,"Lifestyles & Hobbies/Business Professionals,Beauty & Wellness/Frequently Visits Salons,Vehicles & Transportation/Auto Enthusiasts,Home & Garden/Do-It-Yourselfers"
