id,vertical,logical_category,subcategory,Param1,Param2,Param3,title,description,LocationName,city,region,price,image_url,url_item,ext_user_id,weborama_id,interests
2182168444,General,General.GoodsForBusiness,Оборудование для бизнеса,Другое,,,Асик майнер Whatsminer M32 68Th/s,"Асик майнер Whatsminer M32 68Th/s  🔥🔥🔥НОВОЕ и Б/У ОБОРУДОВАНИЕ ДЛЯ МАЙНИНГА ПО ОПТОВЫМ ЦЕНАМ🔥🔥🔥  ЗВОНИТЕ, НА СООБЩЕНИЯ НЕ УСПЕВАЕМ ОТВЕЧАТЬ!  🔥ПОЧЕМУ ИМЕННО МЫ? 🔥  МЫ РАБОТАЕМ НАПРЯМУЮ С ПРОИЗВОДИТЕЛЯМИ И ИМЕЕМ СЕРТИФИКАТЫ О СОТРУДНИЧЕСТВЕ С ЗАВОДАМИ!  📦 Более 7 000 шт. наименований в Москве  🚛 Регулярные поставки до склада  ✅ Тестируем и проверяем в нашем офисе перед оплатой  ✅ фото и видеоматериалы по вашему запросу  ГАРАНТИЯ 6 МЕСЯЦЕВ!!!  ✅Главный офис находится в Москве  ✅Оплата после проверки  ✅Склад в Москве  ✅Прямые поставки из Китая без посредников  ✅На рынке более 5 лет  ✅50 000 довольных клиентов  ✅Подключение майнера к пулу и кошельку  ✅Настройка и ремонт оборудования в нашем/партнёских сервисных центрах  ✅Поставки оборудования в Европу и по всей России  ✅Гарантия на новое оборудование  ✅Свой сервисный центр  ✅ Ежегодные спонсоры всемирной выставки Blockchain life  ХАРАКТЕРИСТИКИ:  · Мощность – 3348 Вт.  · Рабочая влажность – от 5 до 95 %.  · Рабочая температура – от +5 до +45 градусов.  · Используемый чип – BTC/BCH.  · Вес – 14 кг.  · Уровень шума – 80 db.  · Энергопотребление – 3348 W.  Уточняйте наличие и цену на данный момент по телефону или в сообщениях.  АСИКИ БЫСТРО БРОНИРУЮТ И ЗАБИРАЮТ.  Делаем замеры:  · хешрейтов  · энергопотребления  · уровня шума  *цены могут отличаться на момент вашего обращения, актуальное количество и цены на сегодня уточняйте у менеджера.  ЗВОНИТЕ ПРЯМО СЕЙЧАС ☎, наши эксперты бесплатно проконсультируют и подберут лучший вариант для Вас!  Работаем без выходных с 09:00 до 23:00  ______________  Оборудование для бизнеса, оборудование для майнинга, майнинговое оборудование, майнер, асик майнер, antminer, whatsminer, Innosilicon avalon",Воронеж,Воронеж,Воронежская область,0E-15,https://24.img.avito.st/640x480/11718571224.jpg,https://avito.ru/2182168444?utm_medium=cpc&avito_campaign_id=1232320950223423484&utm_source=buzzoola&utm_campaign=web_buzzoola_buyers_b2b_common_all_network_15082021_any_none_b2b,61568456,121823,"Lifestyles & Hobbies/Business Professionals,Beauty & Wellness/Frequently Visits Salons,Vehicles & Transportation/Auto Enthusiasts,Home & Garden/Do-It-Yourselfers"
2236033394,General,General.GoodsForBusiness,Оборудование для бизнеса,Для ресторана,,,Кофемашина Nuova Simonelli Appia 2 II GR S,"ГАРАНТИЯ ЛУЧШЕЙ ЦЕНЫ! ЗВОНИТЕ ПРЯМО СЕЙЧАС! КОФЕМАШИНА В НАЛИЧИИ, ДОСТАВКА 24/7 ПО ВСЕЙ РФ!  Кофемашина Nuova Simonelli: профессиональная полуавтоматическая модель    Удобный функционал, надежность, подходит для высокой проходимости   Модель: Nuova Simonelli Appia II  Cтрана: Италия  Группы: Высокие  - Высокая производительность, приготовление до 4 чашек одновременно;  - Удобная панель управления с подсветкой кнопок;  - Переключатели Push&amp;Pull для паровых кранов;  - Механический циферблат с двойной шкалой – бойлер и помпа;  - Стационарное подключение к водоподаче/водоотведению;  - Медный бойлер с теплоизоляцией Drytex Termal;  - Электронный контроль уровня воды и автонаполнение бойлера;  - Система предварительного заваривания SIS (гарантия идеальной экстракции при неправильной трамбовке кофе)   ----------------------------------------------------    Весь ассортимент магазина можно приобрести:   - в лизинг  - рассрочку  - trade-in   - за наличные / безналичным переводом  ----------------------------------------------------  🎁 Дарим до 6000 рублей за покупку  💲Рассрочка и кредитование до 36 месяцев  🚚 Доставка по России  🤗 Скидка в день рождения вашего заведения  🌐 Сеть магазинов Profbar - это всероссийская компания, занимающаяся продажами кофейного, теплового, холодильного оборудования для кофеен, баров и ресторанов по всей стране.  Наши филиалы для вас открыты в таких городах как:  — Москва, — Санкт-Петербург, — Хабаровск, — Краснодар, — Ростов на Дону, — Анапа, — Махачкала, — Ставрополь, — Нижний Новгород, — Липецк, — Пенза, — Казань, — Пермь, — Челябинск, — Екатеринбург, — Сургут, — Новосибирск, — Красноярск, — Владивосток.  В нашем ассортименте имеются все бренды: Manifesta, Astoria, Casadio, Carimali, Conti, La Cimbali, Nuova Simonelli, Sanremo, Fiamma, Quality Espresso, La Spaziale.  ✔️Льготная доставка в любую точку России и стран ближнего зарубежья по предоплате и наложенным платежом.  ✔️Оплатить товар можно любым привычным для Вас способом.  ⏰ Режим работы:  - Пн-вс с 09-00 до 23-00 без перерывов  ☎️ Звоните прямо сейчас по бесплатному номеру указанному в контактах!  📞📲 Чтобы написать нам в WhatsApp переходите в профиль магазина.  Жмите &quot;❤️ добавить в избранное&quot; и не потеряете объявление.  ----------------------------------------------------  ПЕРЕХОДИТЕ В НАШ МАГАЗИН НА АВИТО!  *При покупке комплекта (кофемашина + кофемолка) доставка и монтаж бесплатно!  Менеджеры Profbar ждут вашего звонка!",Воронеж,Воронеж,Воронежская область,177200.000000000000000,https://32.img.avito.st/640x480/11672482132.jpg,https://avito.ru/2236033394?utm_medium=cpc&avito_campaign_id=1232320950223423484&utm_source=buzzoola&utm_campaign=web_buzzoola_buyers_b2b_common_all_network_15082021_any_none_b2b,182517662,121823,"Lifestyles & Hobbies/Business Professionals,Beauty & Wellness/Frequently Visits Salons,Vehicles & Transportation/Auto Enthusiasts,Home & Garden/Do-It-Yourselfers"
2215040461,General,General.GoodsForBusiness,Оборудование для бизнеса,Промышленное,,,Гидравлический листогибочный пресс (новый),"НОВЫЙ гидравлический листогибочный пресс SHPB 2580 K с ЧПУ Е22 и усилием на 80 тонн для выполнения операций гибки металлических листов от официального дилера ООО КВСИСТЕМС. ЗВОНИТЕ!!!📞  💯 РАБОТАЕМ ПО ВСЕЙ РОССИИ! ОФИЦИАЛЬНАЯ ГАРАНТИЯ! ОБОРУДОВАНИЕ ОТ ЛУЧШИХ МИРОВЫХ ПРОИЗВОДИТЕЛЕЙ!  ✅ Характеристики:  - усилие: 80 тонн  - рабочая длина (мм): 2500  - ход заднего упора (мм): до 600  - зев (мм): 320  - мощность (кВт): 7,5  - вес (кг): 5000  - сегментный пуансон на всю длину в комплекте со станком  ☎️ Позвольте нашим менеджерам подобрать оборудование именно под Ваш бизнес! ЗВОНИТЕ и они сориентируют Вас по оборудованию для производства вентиляционного оборудования, труб, дымоходов, водосточных систем, кровли﻿, фасадных кассет, линеарных панелей, металлических дверей, котлов, дорожных знаков и многих других изделий из листового металла. Ребята ПОДСКАЖУТ по аналогам выгодным именно Вам!  ✅ Также для Вас:  ▪️ помощь и профессиональная консультация в выборе станков, инструмента, оснастки  ▪️ подбор необходимого оборудования для комплектации цеха по производству готовых изделий  ▪️ содействие в запуске производства, настройка и пуско-наладка станков  ▪️ консультации по расширению и оптимизации вашего производства  ▪️ снабжение запасными частями и сервис в течение всего срока службы станка  Преимущества работы с нами:  🏆 Официальный дилер, более 10 лет опыта  🏭 Работаем с лучшими производителями мира  🛠️ Гарантийное и постгарантийное сервисное обслуживание  🤝 Различные формы оплаты  💳 Возможен КРЕДИТ или РАССРОЧКА  🏦 ЛИЗИНГ для компаний  🚚 доставка ПО ВСЕЙ РОССИИ!  👍 ГАРАНТИЯ на продукцию от 12 месяцев  🕑 Работаем с 09:00 до 20:00  Также есть возможность посещения нашего офиса в Москве! Позвоните, и мы подготовим для Вас предложение к приезду.  ☎️ЗВОНИТЕ и ПИШИТЕ (можно на WatsApp и Viber)! С радостью ответим на все ваши вопросы!☎️",Воронеж,Воронеж,Воронежская область,1493425.000000000000000,https://43.img.avito.st/640x480/11775567743.jpg,https://avito.ru/2215040461?utm_medium=cpc&avito_campaign_id=1232320950223423484&utm_source=buzzoola&utm_campaign=web_buzzoola_buyers_b2b_common_all_network_15082021_any_none_b2b,92830185,121823,"Lifestyles & Hobbies/Business Professionals,Beauty & Wellness/Frequently Visits Salons,Vehicles & Transportation/Auto Enthusiasts,Home & Garden/Do-It-Yourselfers"
2182023195,General,General.GoodsForBusiness,Оборудование для бизнеса,Другое,,,Майнер WhatsMiner M31S + 82Th/s,"Майнер WhatsMiner M31S + 82Th/s  🔥🔥🔥НОВОЕ и Б/У ОБОРУДОВАНИЕ ДЛЯ МАЙНИНГА ПО ОПТОВЫМ ЦЕНАМ🔥🔥🔥  ЗВОНИТЕ, НА СООБЩЕНИЯ НЕ УСПЕВАЕМ ОТВЕЧАТЬ!  🔥ПОЧЕМУ ИМЕННО МЫ? 🔥  МЫ РАБОТАЕМ НАПРЯМУЮ С ПРОИЗВОДИТЕЛЯМИ И ИМЕЕМ СЕРТИФИКАТЫ О СОТРУДНИЧЕСТВЕ С ЗАВОДАМИ!  📦 Более 7 000 шт. наименований в Москве  🚛 Регулярные поставки до склада  ✅ Тестируем и проверяем в нашем офисе перед оплатой  ✅ фото и видеоматериалы по вашему запросу  ГАРАНТИЯ 6 МЕСЯЦЕВ!!!  ✅Главный офис находится в Москве  ✅Оплата после проверки  ✅Склад в Москве  ✅Прямые поставки из Китая без посредников  ✅На рынке более 5 лет  ✅50 000 довольных клиентов  ✅Подключение майнера к пулу и кошельку  ✅Настройка и ремонт оборудования в нашем/партнёских сервисных центрах  ✅Поставки оборудования в Европу и по всей России  ✅Гарантия на новое оборудование  ✅Свой сервисный центр  ✅ Ежегодные спонсоры всемирной выставки Blockchain life  ХАРАКТЕРИСТИКИ:  Бренд  WhatsMiner  Размеры, мм  390x155x240  Вес товара, г  10600  Алгоритм майнинга  SHA-256  Хешрейт  82 TH/s  Энергопотребление  3444Вт  Уточняйте наличие и цену на данный момент по телефону или в сообщениях.  АСИКИ БЫСТРО БРОНИРУЮТ И ЗАБИРАЮТ.  Делаем замеры:  · хешрейтов  · энергопотребления  · уровня шума  *цены могут отличаться на момент вашего обращения, актуальное количество и цены на сегодня уточняйте у менеджера.  ЗВОНИТЕ ПРЯМО СЕЙЧАС ☎, наши эксперты бесплатно проконсультируют и подберут лучший вариант для Вас!  Работаем без выходных с 09:00 до 23:00  ______________  Оборудование для бизнеса, оборудование для майнинга, майнинговое оборудование, майнер, асик майнер, antminer, whatsminer, Innosilicon avalon",Воронеж,Воронеж,Воронежская область,0E-15,https://99.img.avito.st/640x480/11725508899.jpg,https://avito.ru/2182023195?utm_medium=cpc&avito_campaign_id=1232320950223423484&utm_source=buzzoola&utm_campaign=web_buzzoola_buyers_b2b_common_all_network_15082021_any_none_b2b,61568456,121823,"Lifestyles & Hobbies/Business Professionals,Beauty & Wellness/Frequently Visits Salons,Vehicles & Transportation/Auto Enthusiasts,Home & Garden/Do-It-Yourselfers"
2215736845,General,General.GoodsForBusiness,Оборудование для бизнеса,Промышленное,,,Гидравлический листогибочный пресс (новый),"НОВЫЙ гидравлический листогибочный пресс HPB-K 80/2500 для выполнения операций гибки металлических листов от официального дилера ООО КВСИСТЕМС. ЗВОНИТЕ!!!📞  💯 РАБОТАЕМ ПО ВСЕЙ РОССИИ! ОФИЦИАЛЬНАЯ ГАРАНТИЯ! ОБОРУДОВАНИЕ ОТ ЛУЧШИХ МИРОВЫХ ПРОИЗВОДИТЕЛЕЙ!  ✅ Характеристики:  - усилие: 80 тонн  - рабочая длина (мм): 2500  - расстояние между колоннами (мм): 1880  - зев (мм): 250  - мощность (кВт): 5,5  - вес (кг): 3600  ☎️ Позвольте нашим менеджерам подобрать оборудование именно под Ваш бизнес! ЗВОНИТЕ и они сориентируют Вас по оборудованию для производства вентиляционного оборудования, труб, дымоходов, водосточных систем, кровли﻿, фасадных кассет, линеарных панелей, металлических дверей, котлов, дорожных знаков и многих других изделий из листового металла. Ребята ПОДСКАЖУТ по аналогам выгодным именно Вам!  ✅ Также для Вас:  ▪️ помощь и профессиональная консультация в выборе станков, инструмента, оснастки  ▪️ подбор необходимого оборудования для комплектации цеха по производству готовых изделий  ▪️ содействие в запуске производства, настройка и пуско-наладка станков  ▪️ консультации по расширению и оптимизации вашего производства  ▪️ снабжение запасными частями и сервис в течение всего срока службы станка  Преимущества работы с нами:  🏆 Официальный дилер, более 10 лет опыта  🏭 Работаем с лучшими производителями мира  🛠️ Гарантийное и постгарантийное сервисное обслуживание  🤝 Различные формы оплаты  💳 Возможен КРЕДИТ или РАССРОЧКА  🏦 ЛИЗИНГ для компаний  🚚 доставка ПО ВСЕЙ РОССИИ!  👍 ГАРАНТИЯ на продукцию от 12 месяцев  🕑 Работаем с 09:00 до 20:00  Также есть возможность посещения нашего офиса в Москве! Позвоните, и мы подготовим для Вас предложение к приезду.  ☎️ЗВОНИТЕ и ПИШИТЕ (можно на WatsApp и Viber)! С радостью ответим на все ваши вопросы!☎️",Воронеж,Воронеж,Воронежская область,1575987.000000000000000,https://79.img.avito.st/640x480/11742682979.jpg,https://avito.ru/2215736845?utm_medium=cpc&avito_campaign_id=1232320950223423484&utm_source=buzzoola&utm_campaign=web_buzzoola_buyers_b2b_common_all_network_15082021_any_none_b2b,92830185,121823,"Lifestyles & Hobbies/Business Professionals,Beauty & Wellness/Frequently Visits Salons,Vehicles & Transportation/Auto Enthusiasts,Home & Garden/Do-It-Yourselfers"
2225795989,General,General.GoodsForBusiness,Оборудование для бизнеса,Другое,,,Asic Antminer l3,"Asic Antminer l3. Быстрая доставка из Китая до Москвы!🚀  💸Актуальные цены по запросу!  👍Все оборудование в комплекте с блоком питания  🚚Собственный офис в Шэньчжэнь, прямые поставки из Китая!  - - - -  ➡ Напишите нам &amp;#34;хочу прайс&amp;#34;.  ➡ Быстро отправим и добавим в наш чат WhatsApp / Telegram  ➡ По запросу отправим наш сайт и Телеграм канал  - - - -  • Предзаказ от лучшего поставщика из Китая  • Работаем по договору с физ и юр лицами  • Приветствуем личную встречу с клиентами  • Отправка в регионы  • Полная видео проверка перед отправкой из Китая!  - - - -  ⭐⭐⭐⭐⭐ Наш рейтинг на Авито 5.0  - - - -  📲Звоните/пишите прямо сейчас!  Добавляйте объявление в ❤Избранное, чтобы не потерять.  - - - -  💸Актуальные цены:  🔥От 5 шт - 75100  🔥От 10 шт - 73100  🔥От 20 шт - 68700  *Количество ограничено, цены меняются каждый день.  - - - -  💥ПОМОЖЕМ ПОДОБРАТЬ ЛЮБОЕ ИНТЕРЕСУЮЩИЕ ВАС ОБОРУДОВАНИЕ ПО САМЫМ ВЫГОДНЫМ ЦЕНАМ!  💥ДОПОЛНИТЕЛЬНО ПРЕДЛАГАЕМ ПАРТНЕРСКУЮ ПРОШИВКУ ДЛЯ ВАШЕГО ОБОРУДОВАНИЯ!  - - - -  👉 ВНИМАНИЕ! Мы предоставляем услуги по размещению в собственном отеле 4.50 кВт/час (обслуживание, охрана, доступ 24/7 удалённо, бесперебойная работа под наблюдением специалистов и uptime 24/7).  👉 Сейчас свободно 700 кВат.  - - - -  Наши преимущества:  ↪ Работаем с 2019 года, все это время помогаем клиентам подобрать оборудование для добычи криптовалюты по самым низким ценам. Берем небольшую комиссию т.к работаем на объём. Предлагаем клиентам оформлять сборные заказы для максимальной выгоды. Работаем по всей России!  - - - -  📌Нажмите на профиль справа или внизу объявления. У нас широкий выбор оборудования для майнинга!  📌Будем рады помочь, ваш CryptoExpert.  Энергопотребление: 796 W  Скорость: 550 Mh/s  Серийный номер: S1VQW",Воронеж,Воронеж,Воронежская область,68700.000000000000000,https://51.img.avito.st/640x480/11727319851.jpg,https://avito.ru/2225795989?utm_medium=cpc&avito_campaign_id=1232320950223423484&utm_source=buzzoola&utm_campaign=web_buzzoola_buyers_b2b_common_all_network_15082021_any_none_b2b,154893523,121823,"Lifestyles & Hobbies/Business Professionals,Beauty & Wellness/Frequently Visits Salons,Vehicles & Transportation/Auto Enthusiasts,Home & Garden/Do-It-Yourselfers"
